{
  "$schema": "http://json-schema.org/draft-07/schema#",
  "title": "Findings",
  "description": "Schema for a list of security findings produced by the scanner engine",
  "type": "array",
  "items": {
    "type": "object",
    "required": [
      "file",
      "line",
      "rule_id",
      "severity",
      "message",
      "environment",
      "confidence",
      "recommendation"
    ],
    "properties": {
      "file": {
        "type": "string",
        "minLength": 1,
        "description": "Relative path to the file containing the finding"
      },
      "line": {
        "type": "integer",
        "minimum": 1,
        "description": "1-based line number where the security issue was found"
      },
      "rule_id": {
        "type": "string",
        "minLength": 1,
        "description": "Unique identifier of the detection rule"
      },
      "severity": {
        "type": "string",
        "enum": ["low", "medium", "high", "critical"],
        "description": "Severity level of the security finding"
      },
      "message": {
        "type": "string",
        "minLength": 1,
        "description": "Human-readable description of the security issue. Must never contain raw secret values."
      },
      "environment": {
        "type": "string",
        "enum": ["production", "local-testing", "unknown"],
        "description": "Target environment classified for the finding context"
      },
      "confidence": {
        "type": "number",
        "minimum": 0.0,
        "maximum": 1.0,
        "description": "Classification confidence score between 0.0 and 1.0"
      },
      "recommendation": {
        "type": "string",
        "minLength": 1,
        "description": "Actionable guidance to remediate the finding"
      }
    },
    "additionalProperties": false
  }
}
